{
  "version": 1,
  "generated_at": "2026-02-19T01:57:12+00:00",
  "source_pack_id": "known-good-1c7d6bb9448a",
  "active_tier": "strict",
  "guideline_count": 10,
  "feature_stats": {
    "bibliography_present": {
      "min": 1.0,
      "max": 1.0,
      "mean": 1.0,
      "median": 1.0,
      "p10": 1.0,
      "p25": 1.0,
      "p50": 1.0,
      "p75": 1.0,
      "p90": 1.0
    },
    "citation_count": {
      "min": 4.0,
      "max": 17.0,
      "mean": 7.2,
      "median": 6.5,
      "p10": 4.0,
      "p25": 4.5,
      "p50": 6.5,
      "p75": 7.75,
      "p90": 9.799999999999997
    },
    "code_token_total": {
      "min": 22.0,
      "max": 486.0,
      "mean": 177.2,
      "median": 122.5,
      "p10": 22.0,
      "p25": 56.75,
      "p50": 122.5,
      "p75": 209.25,
      "p90": 470.70000000000005
    },
    "compliant_examples_count": {
      "min": 1.0,
      "max": 7.0,
      "mean": 2.5,
      "median": 1.5,
      "p10": 1.0,
      "p25": 1.0,
      "p50": 1.5,
      "p75": 2.75,
      "p90": 6.1
    },
    "concept_count": {
      "min": 1.0,
      "max": 19.0,
      "mean": 10.3,
      "median": 12.5,
      "p10": 1.0,
      "p25": 2.5,
      "p50": 12.5,
      "p75": 16.75,
      "p90": 18.1
    },
    "concepts_per_100_words": {
      "min": 0.20080321285140562,
      "max": 6.299212598425197,
      "mean": 2.5002976096645804,
      "median": 1.8786549707602338,
      "p10": 0.20080321285140562,
      "p25": 0.5831446133937237,
      "p50": 1.8786549707602338,
      "p75": 3.7962852186397082,
      "p90": 6.2756777174070955
    },
    "conditions_per_100_words": {
      "min": 0.0,
      "max": 1.0802469135802468,
      "mean": 0.4090713773572923,
      "median": 0.22779426771718805,
      "p10": 0.0,
      "p25": 0.0,
      "p50": 0.22779426771718805,
      "p75": 0.7766071081763448,
      "p90": 1.0326822256046002
    },
    "constraint_phrase_density": {
      "min": 0.0,
      "max": 0.3333333333333333,
      "mean": 0.052775175788317495,
      "median": 0.008579286155563085,
      "p10": 0.0,
      "p25": 0.0006097560975609756,
      "p50": 0.008579286155563085,
      "p75": 0.05117376042123739,
      "p90": 0.10833333333333324
    },
    "example_avg_explanation_words": {
      "min": 9.0,
      "max": 88.0,
      "mean": 42.35333333333334,
      "median": 45.16666666666667,
      "p10": 9.0,
      "p25": 23.025,
      "p50": 45.16666666666667,
      "p75": 56.0,
      "p90": 62.04999999999999
    },
    "example_code_block_count": {
      "min": 2.0,
      "max": 10.0,
      "mean": 4.5,
      "median": 3.0,
      "p10": 2.0,
      "p25": 2.0,
      "p50": 3.0,
      "p75": 6.0,
      "p90": 9.1
    },
    "example_diversity": {
      "min": 1.0,
      "max": 1.0,
      "mean": 1.0,
      "median": 1.0,
      "p10": 1.0,
      "p25": 1.0,
      "p50": 1.0,
      "p75": 1.0,
      "p90": 1.0
    },
    "examples_per_concept": {
      "min": 0.125,
      "max": 2.0,
      "mean": 0.8907099243206055,
      "median": 0.7368421052631579,
      "p10": 0.1713235294117647,
      "p25": 0.22395833333333331,
      "p50": 0.7368421052631579,
      "p75": 1.4027777777777777,
      "p90": 2.0
    },
    "examples_total": {
      "min": 2.0,
      "max": 10.0,
      "mean": 4.5,
      "median": 3.0,
      "p10": 2.0,
      "p25": 2.0,
      "p50": 3.0,
      "p75": 6.0,
      "p90": 9.1
    },
    "non_compliant_examples_count": {
      "min": 1.0,
      "max": 5.0,
      "mean": 2.0,
      "median": 1.0,
      "p10": 1.0,
      "p25": 1.0,
      "p50": 1.0,
      "p75": 2.75,
      "p90": 4.1
    },
    "rationale_present": {
      "min": 1.0,
      "max": 1.0,
      "mean": 1.0,
      "median": 1.0,
      "p10": 1.0,
      "p25": 1.0,
      "p50": 1.0,
      "p75": 1.0,
      "p90": 1.0
    },
    "rule_word_count": {
      "min": 9.0,
      "max": 410.0,
      "mean": 141.2,
      "median": 84.0,
      "p10": 45.9,
      "p25": 50.75,
      "p50": 84.0,
      "p75": 163.75,
      "p90": 365.9
    },
    "rust_term_density": {
      "min": 0.006024096385542169,
      "max": 0.11353711790393013,
      "mean": 0.04703360763955783,
      "median": 0.040873921867072546,
      "p10": 0.006024096385542169,
      "p25": 0.017464114832535883,
      "p50": 0.040873921867072546,
      "p75": 0.07417967327037857,
      "p90": 0.08441644241769927
    },
    "section_count": {
      "min": 5.0,
      "max": 5.0,
      "mean": 5.0,
      "median": 5.0,
      "p10": 5.0,
      "p25": 5.0,
      "p50": 5.0,
      "p75": 5.0,
      "p90": 5.0
    }
  },
  "dimension_weights": {
    "structure": 0.3,
    "specificity": 0.2,
    "evidence": 0.2,
    "citations": 0.15,
    "granularity": 0.15
  }
}
